### ISSUE TITLE
Simplified error example of: TCP Previous segment not captured

### ISSUE THREAD

**Issue by JCzz** [canonical/multipass#3038]
ENV
```
multipass version
multipass   1.11.1+mac
multipassd  1.11.1+mac

Mac Apple M1
MacOS 12.5.1
```

curl hangs half way through a large file(small file no problem) , if the server(multipass vm) is running in multipass on different computers on same LAN.

### Steps

1. Create multipass vm and mount from the same folder:
```
multipass launch --name myvm --network=en0
multipass mount . myvm:~/speed
```

2. Generate a large file:
```
base64 /dev/urandom | head -c 100000 > file.txt
echo "\The end" >> file.txt
```

3. run web server server in multipass vm:
```
multipass shell myvm
cd speed
python3 -m http.server
```

6. Curl to multipass mvm
```
curl <ip>/file.txt
In my case: `curl 192.170.1.231/file`
7AVzmECVWNbcShP+TE+/6AM/KZWc12AzLKvtctv0pqeSW0SNDW3OSM82SkzF+/UExUUBH4dxlIcM
dObLOlLgz9WfoiEtvZ4Hbx/yq85C+WwnFr2Trhu75qmFrg8Ht8t/x+MyDfI0MyuGw91tKqFgHL4F
```

Now it hangs, what to do?

If you run this `python3 -m http.server` on the host computer it works, just not from multipass vm.

If I use Wireshark I can see something standing out right about where it hangs:

```
10287	0.000580	0.000580	64	192.168.1.22	192.170.1.231	TCP	54	53941 → 80 [RST] Seq=1 Win=0 Len=0

4818	0.004338	0.004338	62	192.170.1.231	192.168.1.22	TCP	1514	[TCP Previous segment not captured] 80 → 50623 [ACK] Seq=84853 Ack=86 Win=65152 Len=1448 TSval=1019606200 TSecr=2732723127 [TCP segment of a reassembled PDU]

4820	0.000249	0.000249	64	192.168.1.22	192.170.1.231	TCP	78	[TCP Dup ACK 4817#1] 50623 → 80 [ACK] Seq=86 Ack=67477 Win=131072 Len=0 TSval=2732723132 TSecr=1019605978 SLE=84853 SRE=86301

4821	0.000057	0.000057	64	192.168.1.22	192.170.1.231	TCP	78	[TCP Dup ACK 4817#2] 50623 → 80 [ACK] Seq=86 Ack=67477 Win=131072 Len=0 TSval=2732723132 TSecr=1019605978 SLE=84853 SRE=87749

4822	0.002414	0.002414	62	192.170.1.231	192.168.1.22	TCP	1514	[TCP Fast Retransmission] 80 → 50623 [ACK] Seq=67477 Ack=86 Win=65152 Len=1448 TSval=1019606202 TSecr=2732723132 [TCP segment of a reassembled PDU]

4823	0.000001	0.000001	62	192.170.1.231	192.168.1.22	TCP	1514	[TCP Out-Of-Order] 80 → 50623 [ACK] Seq=68925 Ack=86 Win=65152 Len=1448 TSval=1019606203 TSecr=2732723132 [TCP segment of a reassembled PDU]

4827	0.002141	0.002141	62	192.170.1.231	192.168.1.22	TCP	1514	[TCP Out-Of-Order] 80 → 50623 [ACK] Seq=70373 Ack=86 Win=65152 Len=1448 TSval=1019606205 TSecr=2732723135 [TCP segment of a reassembled PDU]

4829	0.000165	0.000165	62	192.170.1.231	192.168.1.22	TCP	1514	[TCP Retransmission] 80 → 50623 [PSH, ACK] Seq=71821 Ack=86 Win=65152 Len=1448 TSval=1019606205 TSecr=2732723135

4830	0.000002	0.000002	62	192.170.1.231	192.168.1.22	TCP	1514	[TCP Retransmission] 80 → 50623 [ACK] Seq=73269 Ack=86 Win=65152 Len=1448 TSval=1019606205 TSecr=2732723135

4831	0.000000	0.000000	62	192.170.1.231	192.168.1.22	TCP	1514	[TCP Retransmission] 80 → 50623 [ACK] Seq=74717 Ack=86 Win=65152 Len=1448 TSval=1019606205 TSecr=2732723135
```

I have added this issue to:
Hyperkit: https://github.com/moby/hyperkit/issues/338
Qemu: https://gitlab.com/qemu-project/qemu/-/issues/1584
stackoverflow.com: https://stackoverflow.com/questions/73753103/multipass-tcp-previous-segment-not-captured

Thanks

**Comment by sharder996** [comment]
Hi @JCzz, thanks for putting in some time to debug this! We will take a deeper look into this once we get the chance. Or, if you end up finding the root issue, feel free to add more details or submit a fix.

**Comment by JCzz** [comment]
Any new on this one?

**Comment by townsend2010** [comment]
Hi @JCzz!

I'm guessing the important piece to this is a computer on a **different vLAN**, right?  It works fine on the same vLAN.  

Unfortunately, I'm not sure if any of us have a this particular network set up at our disposal, ie, in our homes, but I'll ask the rest of the team to be sure.

**Comment by JCzz** [comment]
Hi @townsend2010
Thanks for replying, and yes it work when on the same vLAN, just not when crossing vLAN. The thing is that it works, when running in Multipass from the host machine to Multipass, therefore I am thinking it must be in Multipass.

Lately I have tried using the latest version with qemu to see if that would make any difference. Unfortunately it is the same.

Thanks again and let me know if you need me to do any tests for you? I would be happy to help, as I really like the easy of use in Multipass.

Regards
Christian

**Comment by townsend2010** [comment]
We will try to reproduce, but since this is using the macOS external interface, I'm thinking it's a bug(?) in Apple's `vmnet` layer (or somewhere else in the Apple virtualized networking stack).

Unfortunately, that is completely a black box and it would probably be very difficult to get the required evidence to get Apple to do anything about this.

Are you still using macOS 12.5.1?  It's *possible* it may have been "fixed" in a newer release.

**Comment by townsend2010** [comment]
Also,
> Question: Is it a "[Bonded interface](https://developers.redhat.com/blog/2018/10/22/introduction-to-linux-interfaces-for-virtual-networking#bonded_interface)", when using --network=en0

No, it is not a bonded interface.  It's presented as a separate interface in the Multipass instance.

**Comment by JCzz** [comment]
Thanks for some heads-up @townsend2010

**Comment by JCzz** [comment]
Using Parallels it work, do you know if they are using vmnet?

**Comment by townsend2010** [comment]
Hi @JCzz!

> Using Parallels it work, do you know if they are using vmnet?

Parallels is a closed source product and they don't really give specific implementation details, but considering it has been around longer than the `vmnet` API, I suspect they use some sort of userspace networking.  Again, just a gut feeling type of guess :slightly_smiling_face:

**Comment by JCzz** [comment]
Anyone know if multipass is using socket_vmnet?

link: https://github.com/lima-vm/socket_vmnet

If so maybe they are able to getting me closer to a solution  - thanks in advance.

**Comment by townsend2010** [comment]
Hi @JCzz!

No, Multipass does not use socket_vmnet.  We use vmnet that is already [in qemu](https://github.com/lima-vm/socket_vmnet#how-is-socket_vmnet-related-to-qemu-builtin-vmnet-support).  At any rate, socket_vmnet and our qemu both use `vmnet` which is think is part of the problem you are observing- some bug in Apple's `vmnet` stack.

The only advantage that socket_vmnet brings is that one does not have to run the qemu process as root, but one would still have to run the vmnet_socket process as root, so I don't think it's a big advantage.

**Comment by JCzz** [comment]
thanks @townsend2010
