### ISSUE TITLE
macOS is filtering ARP requests for additional addresses

### ISSUE THREAD

**Issue by candlerb** [canonical/multipass#1298]
Sometimes a VM needs additional IP addresses.  However multipass on macOS appears to block ARP responses for IP addresses other than the one initially assigned to the machine.

I am using macOS 10.14.6 with multipass `1.0.0+mac`.  To reproduce:

```
$ multipass launch --name test1
$ multipass launch --name test2
$ multipass list | grep test
test1                   Running           192.168.64.6     Ubuntu 18.04 LTS
test2                   Running           192.168.64.7     Ubuntu 18.04 LTS

$ multipass shell test2
sudo -s
ip addr add 192.168.64.111/24 dev enp0s2
tcpdump -i enp0s2 -nn arp or icmp

In another window:

$ multipass shell test1
sudo -s
apt-get update; apt-get install -y arping
root@test1:~# arping 192.168.64.111
ARPING 192.168.64.111
Timeout
Timeout
Timeout
^C
--- 192.168.64.111 statistics ---
4 packets transmitted, 0 packets received, 100% unanswered (0 extra)
```

But in the tcpdump window on test2 you see:

```
root@test2:~# tcpdump -i enp0s2 -nn arp or icmp
tcpdump: verbose output suppressed, use -v or -vv for full protocol decode
listening on enp0s2, link-type EN10MB (Ethernet), capture size 262144 bytes
12:32:58.534329 ARP, Request who-has 192.168.64.111 tell 192.168.64.6, length 46
12:32:58.534376 ARP, Reply 192.168.64.111 is-at 76:e7:3a:b0:02:e0, length 28
12:32:59.604239 ARP, Request who-has 192.168.64.111 tell 192.168.64.6, length 46
12:32:59.604279 ARP, Reply 192.168.64.111 is-at 76:e7:3a:b0:02:e0, length 28
12:33:00.676214 ARP, Request who-has 192.168.64.111 tell 192.168.64.6, length 46
12:33:00.676243 ARP, Reply 192.168.64.111 is-at 76:e7:3a:b0:02:e0, length 28
12:33:01.748195 ARP, Request who-has 192.168.64.111 tell 192.168.64.6, length 46
12:33:01.748226 ARP, Reply 192.168.64.111 is-at 76:e7:3a:b0:02:e0, length 28
```

That is: the ARP broadcasts are being received, the unicast ARP responses are being sent, but they are not being received at the test1 VM (tcpdump on test1 can be used to confirm this too)

The same applies if trying to ARP from the macOS host.  arping to the vm's primary address works fine; arping to the alias address sees no response (but tcpdump on the vm says it's being sent).

This might be an issue with:
* the way multipass configures hyperkit
* the way hyperkit configures the macOS bridge device (in my case I see bridge100)
* or an underlying platform limitation which can't be worked around

--------

Case where this matters: https://github.com/ubuntu/microk8s/issues/908.  Metallb does not work when running a multik8s cluster under multipass, because the additional IP addresses are being blocked.

**Comment by candlerb** [comment]
BTW, this issue is not mentioned at https://multipass.run/docs/troubleshooting-networking-on-macos

**Comment by Saviq** [comment]
Hi @candlerb, thanks for the good explanation. Unfortunately we have no influence over how the bridge is configured :/

It's macOS setting it all up and as mentioned in the doc, even changing the configuration file won't stick, as macOS is rewriting those files at will.

We are considering the switch to [qemu](https://wiki.qemu.org/Hosts/Mac) and will definitely look at networking options there.

There's a link on the bottom of the documentation page where you can improve it, feel free to add a section about ARP, thanks!

**Comment by candlerb** [comment]
I couldn't see a way to edit the document in the forum.  I added a reply instead.
