### ISSUE TITLE
Multipass not working following upgrade to Monterey 12.4 on M1

### ISSUE THREAD

**Issue by andybusuu** [canonical/multipass#2583]
**Describe the bug**
Since upgrading to Monterey 12.4 yesterday I'm seeing timeouts when trying to start multipass VMs on an Apple M1.

**To Reproduce**
Try and start a multipass vm:
```
multipass start k3s-sandbox                                                                                                                                                                                                                     
start failed: The following errors occurred:
k3s-sandbox: timed out waiting for response
```

**Expected behavior**
The VM to start.


**Logs**
```
2022-05-23T12:35:17.446] [debug] [k3s-sandbox] process working dir ''
[2022-05-23T12:35:17.446] [info] [k3s-sandbox] process program 'qemu-system-aarch64'
[2022-05-23T12:35:17.446] [info] [k3s-sandbox] process arguments '-machine, virt,highmem=off, -accel, hvf, -drive, file=/Library/Application Support/com.canonical.multipass/bin/../Resources/qemu/edk2-aarch64-code.fd,if=pflash,format=raw,readonly=on, -cpu, cortex-a72, -nic, vmnet-shared,model=virtio-net-pci,mac=52:54:00:f1:99:6b, -device, virtio-scsi-pci,id=scsi0, -drive, file=/var/root/Library/Application Support/multipassd/qemu/vault/instances/k3s-sandbox/ubuntu-20.04-server-cloudimg-arm64.img,if=none,format=qcow2,discard=unmap,id=hda, -device, scsi-hd,drive=hda,bus=scsi0.0, -smp, 2, -m, 2048M, -qmp, stdio, -chardev, null,id=char0, -serial, chardev:char0, -nographic, -cdrom, /var/root/Library/Application Support/multipassd/qemu/vault/instances/k3s-sandbox/cloud-init-config.iso'
[2022-05-23T12:35:17.453] [debug] [qemu-system-aarch64] [4111] started: qemu-system-aarch64 -machine virt,highmem=off -nographic -dump-vmstate /private/var/folders/zz/zyxvpxvq6csfxvn_n0000000000000/T/multipassd.sKGoBh
[2022-05-23T12:35:17.754] [info] [k3s-sandbox] process state changed to Starting
[2022-05-23T12:35:17.756] [info] [k3s-sandbox] process state changed to Running
[2022-05-23T12:35:17.756] [debug] [qemu-system-aarch64] [4112] started: qemu-system-aarch64 -machine virt,highmem=off -accel hvf -drive file=/Library/Application Support/com.canonical.multipass/bin/../Resources/qemu/edk2-aarch64-code.fd,if=pflash,format=raw,readonly=on -cpu cortex-a72 -nic vmnet-shared,model=virtio-net-pci,mac=52:54:00:f1:99:6b -device virtio-scsi-pci,id=scsi0 -drive file=/var/root/Library/Application Support/multipassd/qemu/vault/instances/k3s-sandbox/ubuntu-20.04-server-cloudimg-arm64.img,if=none,format=qcow2,discard=unmap,id=hda -device scsi-hd,drive=hda,bus=scsi0.0 -smp 2 -m 2048M -qmp stdio -chardev null,id=char0 -serial chardev:char0 -nographic -cdrom /var/root/Library/Application Support/multipassd/qemu/vault/instances/k3s-sandbox/cloud-init-config.iso
[2022-05-23T12:35:17.756] [info] [k3s-sandbox] process started
[2022-05-23T12:35:17.756] [debug] [k3s-sandbox] Waiting for SSH to be up
[2022-05-23T12:35:17.899] [debug] [k3s-sandbox] QMP: {"QMP": {"version": {"qemu": {"micro": 0, "minor": 2, "major": 6}, "package": ""}, "capabilities": ["oob"]}}

[2022-05-23T12:35:17.922] [debug] [k3s-sandbox] QMP: {"return": {}}

[2022-05-23T12:35:31.475] [debug] [k3s-sandbox] QMP: {"timestamp": {"seconds": 1653305731, "microseconds": 475283}, "event": "NIC_RX_FILTER_CHANGED", "data": {"path": "/machine/unattached/device[7]/virtio-backend"}}
```

**Additional info**
 - OS: macOS Monterey 12.3
- `multipass version`: `1.9.0+mac`
- `multipass info --all`
```
multipass info --all 
Name:           k3s-sandbox
State:          Unknown
IPv4:           --
Release:        --
Image hash:     147e0cea207e (Ubuntu 20.04 LTS)
Load:           --
Disk usage:     --
Memory usage:   --
Mounts:         --

Name:           sandbox
State:          Unknown
IPv4:           --
Release:        --
Image hash:     147e0cea207e (Ubuntu 20.04 LTS)
Load:           --
Disk usage:     --
Memory usage:   --
Mounts:         --
```

**Additional context**
I did try deleting all VMs and then uninstalling multipass and re-installing via homebrew. This didn't work.

**Comment by luis4a0** [comment]
Hi @andybusuu! Inspecting the logs you sent, it seems to be a networking issue. Are you connecting through a VPN?

**Comment by andybusuu** [comment]
I tried restarting my laptop as well and got the same `timed out waiting for response` error

```
2022-05-23T14:42:14.120] [warning] [url downloader] Error getting https://multipass.run/static/latest-release.json: Host multipass.run not found - trying cache.
[2022-05-23T14:42:14.134] [info] [update] Failed to fetch update info: failed to download from 'https://multipass.run/static/latest-release.json': Error opening https://multipass.run/static/latest-release.json
[2022-05-23T14:42:14.151] [warning] [url downloader] Error getting https://cloud-images.ubuntu.com/releases/streams/v1/index.json: Host cloud-images.ubuntu.com not found - trying cache.
[2022-05-23T14:42:14.224] [info] [VMImageHost] Did not find any supported products in "appliance"
[2022-05-23T14:42:14.224] [warning] [url downloader] Error getting https://codeload.github.com/canonical/multipass-workflows/zip/refs/heads/main: Host codeload.github.com not found - trying cache.
[2022-05-23T14:42:14.237] [info] [rpc] gRPC listening on unix:/var/run/multipass_socket
[2022-05-23T14:42:14.245] [debug] [qemu-img] [627] started: qemu-img snapshot -l /var/root/Library/Application Support/multipassd/qemu/vault/instances/sandbox/ubuntu-20.04-server-cloudimg-arm64.img
[2022-05-23T14:42:14.664] [info] [daemon] Starting Multipass 1.9.0+mac
[2022-05-23T14:42:14.664] [info] [daemon] Daemon arguments: /Library/Application Support/com.canonical.multipass/bin/multipassd --verbosity debug
[2022-05-23T14:46:22.088] [debug] [sandbox] process working dir ''
[2022-05-23T14:46:22.088] [info] [sandbox] process program 'qemu-system-aarch64'
[2022-05-23T14:46:22.088] [info] [sandbox] process arguments '-machine, virt,highmem=off, -accel, hvf, -drive, file=/Library/Application Support/com.canonical.multipass/bin/../Resources/qemu/edk2-aarch64-code.fd,if=pflash,format=raw,readonly=on, -cpu, cortex-a72, -nic, vmnet-shared,model=virtio-net-pci,mac=52:54:00:f7:26:e0, -device, virtio-scsi-pci,id=scsi0, -drive, file=/var/root/Library/Application Support/multipassd/qemu/vault/instances/sandbox/ubuntu-20.04-server-cloudimg-arm64.img,if=none,format=qcow2,discard=unmap,id=hda, -device, scsi-hd,drive=hda,bus=scsi0.0, -smp, 1, -m, 1024M, -qmp, stdio, -chardev, null,id=char0, -serial, chardev:char0, -nographic, -cdrom, /var/root/Library/Application Support/multipassd/qemu/vault/instances/sandbox/cloud-init-config.iso'
[2022-05-23T14:46:22.157] [debug] [qemu-system-aarch64] [1827] started: qemu-system-aarch64 -machine virt,highmem=off -nographic -dump-vmstate /private/var/folders/zz/zyxvpxvq6csfxvn_n0000000000000/T/multipassd.OxAbcZ
[2022-05-23T14:46:23.173] [info] [sandbox] process state changed to Starting
[2022-05-23T14:46:23.174] [info] [sandbox] process state changed to Running
[2022-05-23T14:46:23.174] [debug] [qemu-system-aarch64] [1828] started: qemu-system-aarch64 -machine virt,highmem=off -accel hvf -drive file=/Library/Application Support/com.canonical.multipass/bin/../Resources/qemu/edk2-aarch64-code.fd,if=pflash,format=raw,readonly=on -cpu cortex-a72 -nic vmnet-shared,model=virtio-net-pci,mac=52:54:00:f7:26:e0 -device virtio-scsi-pci,id=scsi0 -drive file=/var/root/Library/Application Support/multipassd/qemu/vault/instances/sandbox/ubuntu-20.04-server-cloudimg-arm64.img,if=none,format=qcow2,discard=unmap,id=hda -device scsi-hd,drive=hda,bus=scsi0.0 -smp 1 -m 1024M -qmp stdio -chardev null,id=char0 -serial chardev:char0 -nographic -cdrom /var/root/Library/Application Support/multipassd/qemu/vault/instances/sandbox/cloud-init-config.iso
[2022-05-23T14:46:23.174] [info] [sandbox] process started
[2022-05-23T14:46:23.175] [debug] [sandbox] Waiting for SSH to be up
[2022-05-23T14:46:23.915] [debug] [sandbox] QMP: {"QMP": {"version": {"qemu": {"micro": 0, "minor": 2, "major": 6}, "package": ""}, "capabilities": ["oob"]}}

[2022-05-23T14:46:24.118] [debug] [sandbox] QMP: {"return": {}}

[2022-05-23T14:46:44.765] [debug] [sandbox] QMP: {"timestamp": {"seconds": 1653313604, "microseconds": 765863}, "event": "NIC_RX_FILTER_CHANGED", "data": {"path": "/machine/unattached/device[6]/virtio-backend"}}
```

**Comment by luis4a0** [comment]
@andybusuu thanks!

It seems this is an issue which appeared few times with MacOS upgrades. It appears the rules of the MacOS firewall changed between versions, so your Multipass got trapped in the firewall. One possible solution would be (really!) to reboot your computer. If that doesn't work, you can try disabling the firewall.

If disabling the firewall works, then there are some insights which can help you on your situation [here](https://github.com/canonical/multipass/issues/2387), but unfortunately we don't still have a recipe to deal with this.

**Comment by andybusuu** [comment]
@luis4a0 thanks. I also tried uninstalling and installing the latest  OK I tried running `sudo tcpdump -i bridge100 udp port 67 and port 68` while launching a new VM and got this output:
```
tcpdump: verbose output suppressed, use -v or -vv for full protocol decode
listening on bridge100, link-type EN10MB (Ethernet), capture size 262144 bytes
16:05:06.191497 IP 0.0.0.0.bootpc > broadcasthost.bootps: BOOTP/DHCP, Request from 52:54:00:73:a7:a3 (oui Unknown), length 291
16:05:09.873810 IP 0.0.0.0.bootpc > broadcasthost.bootps: BOOTP/DHCP, Request from 52:54:00:73:a7:a3 (oui Unknown), length 291
16:05:14.781448 IP 0.0.0.0.bootpc > broadcasthost.bootps: BOOTP/DHCP, Request from 52:54:00:73:a7:a3 (oui Unknown), length 291
16:05:23.056877 IP 0.0.0.0.bootpc > broadcasthost.bootps: BOOTP/DHCP, Request from 52:54:00:73:a7:a3 (oui Unknown), length 291
16:05:39.468387 IP 0.0.0.0.bootpc > broadcasthost.bootps: BOOTP/DHCP, Request from 52:54:00:73:a7:a3 (oui Unknown), length 291
16:06:11.590236 IP 0.0.0.0.bootpc > broadcasthost.bootps: BOOTP/DHCP, Request from 52:54:00:73:a7:a3 (oui Unknown), length 291
16:07:15.549317 IP 0.0.0.0.bootpc > broadcasthost.bootps: BOOTP/DHCP, Request from 52:54:00:73:a7:a3 (oui Unknown), length 291
16:08:18.985670 IP 0.0.0.0.bootpc > broadcasthost.bootps: BOOTP/DHCP, Request from 52:54:00:73:a7:a3 (oui Unknown), length 29
```

Sounds like it's a [known issue.](https://github.com/canonical/multipass/issues/2387#issuecomment-1039033725) Fingers crossed you guys are able to fix it. If I can assist with running any debugging let me know 💪  Thanks for the help! 🙏

**Comment by luis4a0** [comment]
@andybusuu Something you can try is to go to System Preferences -> Sharing, enable Internet Sharing and then disable it. This solution used to work in most cases. And you can go to System Preferences -> Security & Privacy and disable the firewall. 

On the other hand, I don't think we can do much about this, for we don't know what changed in the MacOS firewall. Thanks for reporting!

**Comment by luis4a0** [comment]
Duplicate of #2387.
